<?xml version="1.0" encoding="UTF-8"?>
<task-list xmlns:xsi="http://www.w3.org/2001/XMLSchema-instance"
           xsi:noNamespaceSchemaLocation="tasks.xsd">
    <task id="1">
        <title>Сделать зарядку</title>
        <date>2026-04-10</date>
        <time>07:00</time>
        <description>Выпить стакан воды, сделать 15 минут зарядки, принять душ</description>
    </task>
    <task id="2">
        <title>Изучить Python</title>
        <date>2026-04-10</date>
        <time>10:00</time>
        <description>Изучить основы Python: переменные, циклы, функции, списки, словари, работу с файлами и библиотеки</description>
    </task>
    <task id="3">
        <title>Написать парсер на Python</title>
        <date>2026-04-10</date>
        <time>14:00</time>
        <description>Создать парсер для сбора данных с сайта с использованием библиотек requests и BeautifulSoup, сохранить результат в JSON</description>
    </task>
    <task id="4">
        <title>Прогулка на свежем воздухе</title>
        <date>2026-04-10</date>
        <time>17:00</time>
        <description>Выйти на улицу, пройти 5000 шагов, подышать свежим воздухом</description>
    </task>
    <task id="5">
        <title>Изучить C#</title>
        <date>2026-04-10</date>
        <time>20:00</time>
        <description>Изучить основы C#: типы данных, классы, наследование, интерфейсы, LINQ и асинхронное программирование</description>
    </task>
</task-list>